title,company,location,date,link,description,seniority,employment,function,industry
Junior Consumer Insights Manager C&EE,JDE Peet's,"Bucharest, Romania",2026-04-19,https://ro.linkedin.com/jobs/view/junior-consumer-insights-manager-c-ee-at-jde-peet-s-4267997311?position=1&pageNum=0&refId=6MBwGEUHQspve7C%2FK6C2aw%3D%3D&trackingId=%2FtEFo9%2BsOYYtUBauNAd0Aw%3D%3D,"Company DescriptionWho we are?JDE Peet’s is the world's leading pure-play coffee and tea company, with local roots dating back to 1753, and is headquartered in the Netherlands. We unleash the possibilities of coffee and tea in more than 100 countries with a portfolio of over 50 brands, including L’OR, Peet’s, Jacobs, Senseo, Tassimo, Douwe Egberts, OldTown, Super, Pickwick and Moccona.What’s it like to work at JDE Peet’s?We are people united by the power and possibility of tea and coffee. At JDE Peet’s, we thrive on the freedom to pursue opportunities, provoking new ideas to make an impact at scale. Our ambition is simple – JDE Peet's: unleashing the possibilities of coffee and tea.We bring action to our intentions, following through on what was agreed, always pushing things forward. We offer our people a range of learning and development programmes to support their personal growth.At JDE Peet's, we believe it’s amazing what can happen over a cup of coffee or tea.Apply to unleash a cup of amazing for your career. UNLEASH YOUR POSSIBILITY! Find out more at http://careers.jdepeets.comJob DescriptionAre you ready to turn data into meaningful stories? As our Junior Consumer Insights Manager, you will help shape our marketing strategy by analyzing market trends and consumer behaviour across Romania and Bulgaria. You’ll be part of a dynamic, multicultural team and work closely with top-tier research partners like NielsenIQ and YouGov. This semi-autonomous role offers the opportunity to grow your research capabilities while directly influencing business decisions in the coffee category.🧩 What You'll DoTrack and interpret coffee market trends using syndicated data (e.g., NielsenIQ, YouGov)Manage collaboration with external research agencies to ensure timely, reliable data and seamless internal reportingUtilize internal and external data sources to deliver meaningful insights through tailored presentationsTranslate complex datasets into clear and actionable recommendations for the businessSupport design and interpretation of consumer research studies (quantitative & qualitative) to uncover deeper category insightsContribute to strategic planning and forecasting by integrating consumer, market, and macroeconomic dataQualificationsWorking at JDE Peet’s is hands-on, giving you an opportunity to leave your mark. We are a fast-paced company on a mission. Our focus demands high-energy people who think fast and act quickly. If you have the courage and confidence to venture into new cultures & territories, and you're brimming with an entrepreneurial spirit and a drive to succeed, you’ll fit right in at JDE Peet’s.🎯 What We're Looking ForBachelor's degree (or higher) in Market Research, Economics, Statistics, Psychology, Sociology, or related fieldsAt least 3 years’ experience in market research (agency or in-house FMCG analytics)Proficiency in Microsoft Excel and PowerPointExcellent analytical skills with an eye for accuracy and insightStrong communication abilities—you can craft compelling stories out of numbersFluent English and Romanian speaker, both verbal and writtenProactive and curious mindset with a passion for learning⭐ Bonus PointsHands-on experience with NielsenIQ Discover or similar platformsFamiliarity with data visualization tools (e.g., Power BI, Tableau)Passionate about consumer behavior and turning data into impactWhy Join Us? Work in an inclusive, globally connected teamImpact real business decisions with your insightsGain exposure to leading research tools and strategiesGrow your expertise in a high-interest category—coffee!Enjoy a culture of innovation, support, and continuous learningBenefit from a generous package, including:Meal vouchers for daily convenienceComprehensive health coverageAccess to a company-sponsored wellness programBookster subscription for your personal and professional developmentExtra vacation days plus additional free days throughout the yearUnlimited free coffee to fuel your insights ☕Additional InformationYour application at JDE Peet'sIf you are interested in this career opportunity at JDE Peet's, apply and join us. After receiving your application we will do our utmost to give you quick feedback. Part of the recruitment procedure at JDE Peet's would be an online assessment, followed by interviews. A pre-employment check can be part of the recruitment process.Our DE&I StatementAt JDE Peet’s we aim to create a better future where we authentically serve, reflect and embrace everyone. We believe in fostering a more diverse, equitable and inclusive organisation where everyone feels comfortable to truly be who they are and unleash their full potential. This means we do not tolerate discrimination on the basis of our race, ethnicity, sex, gender identity, sexual orientation, religion, nationality, age, disability, or any other trait protected by law.Throughout the entire employee lifecycle, we place DE&I at the core of our people processes. This enables us to drive objectivity and eliminate any potential bias, ensuring an inclusive experience in the workplace. Do not hesitate to reach out if you require any reasonable adjustments to the recruitment process.Our efforts on this agenda have earned us the prestigious Catalyst Award, as well as the Fair Pay Leader Certification in 2025 thanks to an unexplained gender pay gap of 0.52%.#unleashyourpossibility #acupofamazing



        
            Show more
          

          



        
            Show less",Nivel mediu de experiență,Full-time,Altele,Bunuri de larg consum
Business Analyst,CGI,Bucharest Metropolitan Area,2026-05-03,https://ro.linkedin.com/jobs/view/business-analyst-at-cgi-4378608794?position=2&pageNum=0&refId=6MBwGEUHQspve7C%2FK6C2aw%3D%3D&trackingId=0xhE447HtgW3ekJulUu2xA%3D%3D,"Position DescriptionWe are looking for a Business Analyst to join CGI team. In this role, you will act as the link between business stakeholders and technical teams, ensuring that requirements are clearly defined, documented, and translated into effective technology solutions. You will contribute to the delivery of reliable systems, process improvements, and data-driven decision-making across the organization.Your future duties and responsibilities Gather, analyze, and document business and functional requirements through workshops, interviews, and stakeholder meetings. Translate business needs into clear specifications, user stories, process flows, and acceptance criteria for development teams. Collaborate closely with project managers, developers, QA specialists, and other IT team members throughout the project lifecycle. Support solution design by evaluating options, identifying risks, and recommending practical approaches aligned with business goals. Participate in sprint planning, backlog refinement, and user acceptance testing. Ensure traceability of requirements from initial request through implementation and post-release validation. Facilitate communication between technical and non-technical stakeholders, ensuring shared understanding and alignment. Contribute to process improvements and documentation standards within the IT function.Required Qualifications To Be Successful In This Role Minimum four years of experience as a Business Analyst within IT or technology-driven projects. Strong command of English, both written and spoken. Proven experience in requirements elicitation, documentation, and stakeholder management. Familiarity with Agile and/or Waterfall methodologies. Experience working with tools such as JIRA, Confluence, or similar collaboration platforms. Solid analytical thinking, problem-solving skills, and attention to detail. Ability to manage multiple priorities and work effectively in cross-functional teams.What you’ll find at CGI:Employee Share Purchase PlanInvest alongside CGI through a share purchase plan that is partially co-funded by the company. You can access your investment whenever you choose.Healthcare & Insurance CoverageYou and your family are covered through a healthcare and dental subscription, along with life insurance that includes medical coverage for your children.Practical Benefits, Easy to UseOur online benefits platform brings everything together in one place—from meal vouchers and tickets to medical services, online courses, and access to hobby and leisure activities.Learning That Matches Your InterestsUse CGI Academia, our internal learning platform, to build skills relevant to your role and future plans. You can also learn up to nine languages through goFLUENT, included in the platform.Confidential Mental Health SupportThrough the Member Assistance Program (MAP), you have access to confidential professional support for both personal and work-related situations, available at no cost.Books Delivered to the OfficeWith Bookster, you can borrow from a modern public library, with books delivered directly to the office.Referral ProgramIf you recommend someone who joins CGI, you’ll receive a referral bonus—our way of thanking you for helping us grow the team.Volunteering, When You ChooseCGI for Good connects you with volunteering initiatives where you can contribute to causes that matter to you.Time OffAnnual leave ranges from 21 to 26 days, depending on your level of seniority.Office LocationOur Bucharest office is in The Bridge Building, close to Grozavesti metro station, offering easy access and a calm working environment.Hybrid Work ModelWe work in a hybrid setup, combining time at the office with the flexibility of working remotely.Together, as owners, let’s turn meaningful insights into action.Life at CGI is rooted in ownership, teamwork, respect and belonging. Here, you’ll reach your full potential because…You are invited to be an owner from day 1 as we work together to bring our Dream to life. That’s why we call ourselves CGI Partners rather than employees. We benefit from our collective success and actively shape our company’s strategy and direction.Your work creates value. You’ll develop innovative solutions and build relationships with teammates and clients while accessing global capabilities to scale your ideas, embrace new opportunities, and benefit from expansive industry and technology expertise.You’ll shape your career by joining a company built to grow and last. You’ll be supported by leaders who care about your health and well-being and provide you with opportunities to deepen your skills and broaden your horizons.Come join our team—one of the largest IT and business consulting services firms in the world.



        
            Show more
          

          



        
            Show less",Asociat,Full-time,"Cercetare, Analist și Tehnologia informației",Servicii IT și consultanță IT
New Job Opportunities at Wafra,ABANA (abana.co),"23 August, Constanţa, Romania",2026-04-06,https://ro.linkedin.com/jobs/view/new-job-opportunities-at-wafra-at-abana-abana-co-4397742671?position=3&pageNum=0&refId=6MBwGEUHQspve7C%2FK6C2aw%3D%3D&trackingId=ioGCEbYAmZtJ9aOBt5sSvg%3D%3D,"August 23, 2022ABANA Members,We are pleased to share with you a few job opportunities from ABANA member Wafra Inc. in New York. Please feel free to circulate to your networks. If you have any questions, you may reach out to adoumar@abana.co.About Wafra:Wafra Inc. is a leading global investment firm currently managing approximately $32 billion in assets and commitments across a variety of asset strategies. Behind our investment strategies are talented professionals, principally in New York and other financial centers, who bring expertise and experience to deliver strategic, reward-focused solutions. Wafra seeks to provide long-term investment return solutions that span not just years, but generations.To view more job opportunities, check Wafra’s Careers PagePosition: Real Estate Asset Management AssociateReports to: Director-Alternative Real Estate Asset ManagementPosition Summary:The Associate will primarily focus on Alternative Real Estate Asset Management. Alternative real estate is a direct investing strategy targeting niche real estate asset classes (SFR, medical office, marinas, car washes, student housing, etc.)The Associate will be involved in all aspects of the asset management process and will be responsible for providing analytical review of property level transactions and real estate platforms and portfolio companies including, but not limited to: new leases, capital projects, financing events, and dispositions. Additional responsibilities will include the review of property level reporting, preparation of investor level reporting, updating argus files, and providing general support to the asset management team for investments primarily in the United States. The position will be based in New York.Duties And Responsibilities:Oversee the day-to-day management of existing alternative real estate assets held in owned platforms, direct or joint venture ownership structures as directed Work closely with all team members, investment partners, third party management companies, and other key relationships to ensure the proper management and oversight of the portfolioAnalyze and review property level information including, financial reports, leasing information, and property level distribution information Maintain and update financial models used within the group to analyze property level decisions, produce forecasts, and prepare/review annual budgets utilizing both Argus and ExcelWork actively with senior management (VP and above) on investor level reporting, including the preparation and review of materials Input, maintain, and update critical data for existing assets under management to ensure compliance of internal protocols and various reporting objectives are achievedGather and evaluate economic, demographic, and real estate market data for the purpose of making specific investment recommendations under the guidance of senior managementAssemble and draft investment memoranda along with any related support material for review by senior managementPrepare ad-hoc reports and assist on special projectsParticipate in property and market toursTravel as necessaryOther duties as assignedRequirements:Degree from a top-tier university with strong academic performance, MBA or MS with a Real Estate focus preferredApproximately 3-5 years relevant work experience, preferably across a broad spectrum of property typesExperience in acquisitions, finance, leasing, asset management, or development is a plusExcellent financial/quantitative skills and fluency in Excel, Word, PowerPoint, and Argus softwareMust possess the ability to prepare detailed analyses and to make well-reasoned, decisive recommendations to senior managementOutstanding written and oral communication skillsPosition is based in New York and will be expected to be in-person 5 days a weekJob Application LinkPlease send your resume to aidrecruiting@wafra.com with the subject line “Associate, Alternative Real Estate Asset Management” if interested.Position: Vice PresidentReports to: Managing Director – Absolute Return StrategiesPosition Summary:Wafra is seeking a Vice President in its Alternative Investments Division (“AID”) for immediate hire. The Vice President will primarily focus on AID’s Absolute Return Strategies mandate with a focus on special situation transactions. The Vice President will also have the ability to work across AID’s other business lines, including infrastructure, alternative real estate, and financial services private equity.The Absolute Return Strategies’ Special Situation mandate targets senior debt, mezzanine debt, preferred equity and structured equity solutions investments in niche, off-the-run opportunities which are largely uncorrelated with public market indices. The strategy is focused on private market transactions but has flexibility to opportunistically invest in public market dislocations. The strategy primarily targets opportunities within the Real Asset and Financial Services industries.Duties And Responsibilities:Work as part of deal team analyzing special situation investment opportunities, including direct investments and joint ventures across private and public marketsAbility to lead and manage all aspects of transaction execution: negotiation of deal documentation, transaction structuring, coordination with 3rd parties, due diligence, on site diligence, and managing counselEfficient quantitative and qualitative due diligence on prospective investmentsNetworking and sourcing prowess and development of market relationshipsCareer track position with the ability to source deals and drive investment strategyClear and concise communication of investments to investment committeesEngaging in portfolio asset management and monitoring, helping drive successful investment exitsRequirements:Passion for investments in complex, off-the-run situationsDegree from a top-tier university with strong academic performance (MBA not required)6 – 10 years of relevant work experience, preferably with experience at a top-tier private credit or special situation firmAbility to invest across the capital structure with a broad industry knowledge, including Real Assets and Financial ServicesExcellent quantitative skills with experience building bespoke financial modelsOutstanding communication, leadership, and interpersonal skillsPosition is based in New York and will be expected to be in-person 5 days a weekJob Application LinkPlease send your resume to: p.steinberger@wafra.com and w.corbett@wafra.com with the subject: “Vice President, Absolute Return Strategies” if interested.Position: Senior Associate, ESGReports to: DirectorPosition Description:Wafra is seeking a highly motivated, experienced Senior Associate to join its Sustainable Investment Group. This team is responsible for integrating environmental, social and governance (“ESG”) principals across Wafra’s diverse asset classes which focus heavily on private equity, real estate and other alternative investment strategies. We actively seek solutions and work closely with Wafra’s investment teams to conduct ESG diligence and implement value creation initiatives across a range of complex investment strategies in order to build long-term sustainable businesses.The Sustainable Investment Senior Associate will play a lead role in ESG value creation initiatives while also aiding in research and diligence across Wafra’s diverse alternative investments. The candidate should have a background or formal education in finance with a deep understanding of private markets and alternative investments.Duties And Responsibilities:Devise and implement sustainability-focused solutions to help create value for Wafra’s existing portfolio companies across private equity, venture capital, real estate and infrastructureCreate value creation plans for potential new portfolio companies on a range of topics including resource efficiency, best-in-class ESG practices and innovative business opportunitiesResearch and collaborate extensively with investment teams to conduct ESG diligence on new investment opportunities and monitor the performance of existing portfolio companiesAnalyze and apply market research to aid in creating best-in-class ESG frameworks for Wafra and its portfolio companiesResearch and publish thought leadership and develop informed opinions on emerging global ESG-related regulation, sector-specific opportunities and risks as well as broader macroeconomic ESG trendsPresent to global asset owners on a range of ESG integration frameworks that are customized based on complex deal structuresDevelop data management capabilities/tools to ensure that performance improvement data is captured, collected and analyzed to track progress, metrics and efficienciesSupport leadership required to maintain a cohesive, adaptable ESG strategy with Wafra’s portfolio companiesAssist the team in creating customized solutions for sustainability and C-suite leaders of Wafra’s portfolio companies to reduce ESG risk and capture value creation opportunitiesDevelop and deliver promotional and educational programs to ensure portfolio companies embrace ESG fundamentalsCommunicate Wafra’s sustainability program to internal teams, portfolio companies and external stakeholders to educate and win support from these various constituenciesSupport the Sustainable Investment Group in monitoring, analyzing and communicating developments in industry standards and ensure adherence to pertinent legislationAssist with publications and develop presentations for clientsRequirements:Minimum of 4-5 years of experience in a management or financial consulting role or, alternatively, in an investment banking, ESG research or product management role at an asset managerEntrepreneurial spirit and robust work ethic with the ability to independently devise and execute projects to completionFinancial research experience with the ability to apply findings within ESG integrationExcellent verbal, written and analytical skillsResults-oriented mindset with a dedication to analyzing sustainability factors and innovating ways to retain and create valueDemonstrated experience working with alternative investmentsCapacity to handle multiple tasks at a time with strong attention to detailAbility to interact effectively and professionally with clients within the financial industryMBA/CFA/CAIA a plusJob Application LinkPlease send your resume to ESGRecruiting@wafra.com with the subject “Senior Associate, ESG”. if interested.
        


        
            Show more
          

          



        
            Show less",Nivel mediu de experiență,Full-time,Altele,Asociații profesionale
