title,company,location,date,link,description,seniority,employment,function,industry
Junior Research Analyst,Stefanini EMEA,"Bucharest, Bucharest, Romania",2026-04-28,https://ro.linkedin.com/jobs/view/junior-research-analyst-at-stefanini-emea-4406297684?position=4&pageNum=0&refId=6MBwGEUHQspve7C%2FK6C2aw%3D%3D&trackingId=vaFNYPpq55qNiGqV4Zdzow%3D%3D,"Job DescriptionStefanini Romania is looking for Junior Research Analysts to join PEREP Analytics, an initiative of Invest Europe. You will be part of a pan-European team of researchers and analysts that is in charge of one of the largest Data Intelligence projects on the European Private Equity & Venture Capital market.Job Responsibilities: Data collection: collection and validation of data from various sources of information, assistance to data contributors, increase response rate, preliminary data audit  Client Service: coordinate work with national Private Equity Associations for the countries in charge of, deliver periodical or ad-hoc reports, based on their data requirements  Reporting: perform data audits, create standard reports and run custom data queries for our various data client;  Your role will be European-wide Job Requirements We are looking for enthusiastic, proactive people, with ability and desire to work with numbers, eager to improve their communication and analytical skills  We are strong believers in personal development, and we offer you our full support towards internal progress (senior analyst or area coordinator) and prepare you for the wide range of opportunities outside the project  We offer full induction training on the Private Equity market, on analysis and reporting tools (such as MS Excel and MS PowerPoint) and on our proprietary platforms of data collection and data management  You will be part of a one-year coaching/ mentoring program, with a dedicated senior analyst, to further develop your knowledge of the investment market and enhance your communication, analytical and reporting skills  English - advanced; another European language - conversational  Graduate or still studying (Master's degree), preferably in the field of economics. Work experience is not mandatory What we offer:You will find here not only a challenging and interesting workplace, but also a rewarding work experience, with competitive compensation and benefit packages: Soft skills and technical training for current and emerging products and technologies;  Career development: opportunity to grow within the team;  Special referral bonuses for recommending your friends;  Private Medical subscription;  A monthly budget for flexible benefits program that includes public transportation reimbursement and meal tickets, sport & wellness, telecom & electronics, children & parents, holiday & culture, tourism;  Extra vacation days;  Flexible working hours and work from home, aligned with project needs;  Friendly team who is eager to meet you. What's next:It's best to apply today, because job postings can be taken down and we wouldn't want you to miss this opportunity. In case you need further information, just send us a message at recruitmentEMEA@stefanini.com and we'll be happy to assist!The preceding job description had been designed to indicate the general nature and level of work performed by employees within this classification. It is not designed to containor be interpreted as a comprehensive inventory of all duties and responsibilities required of employees assigned to this job.Diversity & InclusionHere at the Stefanini Group, we value plurality and equity, regardless of race, sexual orientation, disability, age, ancestry, religion, gender, and nationality. We understand and encourage the importance of being you!About UsWe are a Brazilian company with over 35 years of experience in delivering IT services worldwide, ranging from IT outsourcing to application development or IT staffing. We have a direct presence in 41 countries, through our 70 offices located throughout the world. We have managed to become the preferred partner of many small-to-midsize local and regional companies as well. Most of our clients come from industries such as financial services, manufacturing, telecommunications, chemical, services, technology, public sector and utilities.Stefanini has career opportunities locally and around the world for professionals interested in a vibrant, passionate, team-oriented workplace. If you are a customer-centric person with a ""get it done"" attitude, come over for coffee and a talk on your future career with us! Learn more about us on www.stefanini.com and join us on LinkedIn , Facebook and Instagram where we regularly post insights from our colleagues.



        
            Show more
          

          



        
            Show less",Nivel mediu de experiență,Full-time,"Cercetare, Analist și Tehnologia informației",Consultanță și servicii de afaceri
Financial Controller,Mercedes-Benz Romania,"Voluntari, Ilfov, Romania",2026-04-30,https://ro.linkedin.com/jobs/view/financial-controller-at-mercedes-benz-romania-4408750341?position=5&pageNum=0&refId=6MBwGEUHQspve7C%2FK6C2aw%3D%3D&trackingId=OFqxQTXN6%2FAxbwy5c0IhhA%3D%3D,"If you believe “premium” and “excellence” should describe not only products, but also the way we work, you’ll feel at home here. In this role, you’ll help create transparency and structure across our controlling, planning, and reporting processes, ensuring we stay on track with profitability goals, deadlines, and business needs; with strong collaboration across teams. You’ll be part of a function where finance is more than numbers: it’s a true partner in shaping strategic and operational decisions through solid analysis, forecasting, and smart insights.Your MissionYou ensure clear and efficient controlling and planning processes, aligned with guidelines and deadlines, and shaped by business needs and input from key partners, including monitoring profitability and relevant KPIs. You analyze and forecast financial and economic data to provide accurate, timely insights that support both strategic and operational decision-making. Key ResponsibilitiesYou will act as a reliable financial partner and help turn data into decisions by:Owning structured bottom-up planning for your allocated business areas, keeping partners informed on progress and key changes. Monitoring spending efficiency and KPI development to ensure profitability targets are achieved. Executing the monthly closing process with accuracy, efficiency, and accountability. Delivering timely, relevant reporting and financial analysis tailored to internal stakeholders’ needs. Evaluating financial impacts of business cases and spotting optimization opportunities. Supporting the creation and continuous improvement of dashboards, and contributing to the implementation of best AI practices in reporting/analysisEnsuring the performance and monitoring of compliance-related internal controls in your area. What We’re Hoping You’ll BringWe’d love to get to know you if you…Share our values of passion, integrity, respect, discipline, and diversity. Feel comfortable taking responsibility and ownership, and enjoy bringing structure to complex topics. Understand how finance supports business success; and you’re motivated to be a proactive partner, not just a reporting function. Enjoy working with data and turning it into insights people can act on (planning, KPIs, forecasts, reporting, dashboards). Why This Role Matters Your work will directly influence how well the organization plans, spends, and delivers results and you’ll help teams make decisions with confidence. If you like combining precision with collaboration, and you find satisfaction in making things clearer, faster, and smarter, this could be a great next step.Ready to Apply?If this sounds like you, we’d be happy to learn more about your story. *Only selected candidates will be contacted for further steps in the recruiting process



        
            Show more
          

          



        
            Show less",Asociat,Full-time,"Contabilitate/Audit, Finanțe și Consultanță",Fabricația de autovehicule
Data Scientist - Remote,YO IT Consulting,Romania,2026-05-03,https://ro.linkedin.com/jobs/view/data-scientist-remote-at-yo-it-consulting-4408344746?position=6&pageNum=0&refId=6MBwGEUHQspve7C%2FK6C2aw%3D%3D&trackingId=AlbPxm71muGdGx%2BYuGwqrA%3D%3D,"Job Title: Data ScientistJob Type: ContractorLocation: RemoteJob SummaryJoin our customer team as a Data Scientist and play a pivotal role in transforming data into actionable insights that drive business growth. You will leverage your expertise in statistics, mathematics, and programming to tackle challenging data problems, ensuring clean, robust, and insightful analyses. This is an exciting opportunity to work in a dynamic, expert-driven environment that values clear communication and innovative thinking.Key ResponsibilitiesCollect, clean, and preprocess diverse data sets to ensure integrity and readiness for analysis.Develop, validate, and implement statistical models to extract actionable insights from complex data.Conduct exploratory data analysis to identify trends, patterns, and opportunities for business improvement.Present findings and recommendations through compelling data visualizations and reports, tailored for technical and non-technical stakeholders.Collaborate closely with team members to design and execute end-to-end data projects, from ideation to delivery.Continuously improve analytical methodologies and automation processes to enhance data workflows.Communicate effectively in both written and verbal formats, ensuring clarity and impact of data-driven recommendations.Required Skills And QualificationsExpertise in statistics, mathematics, and data analysis techniques.Proven experience in collecting, handling, and cleaning large, complex data sets.Proficiency in programming languages such as Python, R, or similar for data manipulation and modeling.Strong data modeling skills with experience in building and validating predictive models.Advanced ability to visualize data using tools like Tableau, Power BI, or related libraries.Meticulous attention to detail and commitment to data quality at every stage.Excellent written and verbal communication skills, with an emphasis on clarity and precision.Preferred QualificationsExperience working in a remote, cross-functional, or customer-focused team environment.Background in developing and deploying machine learning solutions in production settings.



        
            Show more
          

          



        
            Show less",Începător,Full-time,Inginerie și Tehnologia informației,Dezvoltare de software
Analytics & Insights Partner,the LEGO Group,"Bucharest, Bucharest, Romania",2026-04-29,https://ro.linkedin.com/jobs/view/analytics-insights-partner-at-the-lego-group-4406083281?position=7&pageNum=0&refId=6MBwGEUHQspve7C%2FK6C2aw%3D%3D&trackingId=kmON2GIvjHD3DMR%2BIA3b3g%3D%3D,"Job DescriptionWe are seeking an Analytics & Insights Partner to act as a strategic advisor, delivering data-driven insights that advise decisions, optimise performance, and drive commercial growth.As a key informer to the Romania, Bulgaria and Israel (ROBGIS) business unit leadership team, you will combine business commercial insight, analytical expertise, and storytelling skills to support both short-term goals and long-term strategies.We're pleased to share that we offer a hybrid working week arrangement called Best of Both, requiring 3 days in the office location and 2 days from home.No relocation or visa support/assistance is offered for this position.The closing date for all applications will be Wednesday 13th May 2026.Core ResponsibilitiesStrategic Advisory Collaborate with leadership to develop tailored analytic solutions and track key performance metrics. Performance Analysis & Insights Provide deep-dive analyses on business performance, uncovering actionable insights. Forecasting & Advanced Analytics Apply statistical modelling and forecasting tools to anticipate trends and inform strategies. Storytelling Translate complex data insights into compelling narratives for non-technical partners. Cross-Functional Collaboration Partner with marketing, sales, finance, and operations to align insights with business strategies. Independent Project Management Lead ad hoc analyses, resolve conflicts, and deliver insights with minimal guidance. Key Deliverables Build and maintain and regularly present performance reporting for the region to the GM and Leadership Team. Analyse and present data from pricing, promotions, and product mix to identify growth opportunities and mitigate risks. Implement forecasting tools and guide decision-making through insights. Train teams on self-service data tools and recommend additional solutions. Support “test and learn” experiments, providing clear result's analysis. Integrate insights from industry and shopper data to inform commercial strategies. Do you have what it takes?Minimum C1 level of fluency in English.Experienced in (advanced) analytics and data insights roles, preferably in consumer goods, retail or consultancy company.Ability to verbally present insights in a clear and actionable format for senior leadership up to General Manager level.Strong understanding of commercial market trends, commercial performance drivers, and consumer behaviour. Skilled in partnering with cross-functional teams and influencing decisions.Proven experience in building structuring datasets. Ability to synthesise data for diverse audiences and manage ad hoc projects. Intermediate expertise in SQL, Python, and tools like Snowflake or Databricks. Proficient in data modelling, exploratory analysis, and statistical techniques. Applications are reviewed on an ongoing basis. However, please note we do amend or withdraw our jobs and reserve the right to do so at any time, including prior to any advertised closing date. So, if you're interested in this role we encourage you to apply as soon as possible.What’s in it for you?Here is what you can expectFamily Care Leave - We offer enhanced paid leave options for those important times.Insurances – All colleagues are covered by our life and disability insurance which provides protection and peace of mind.Wellbeing - We want our people to feel well and thrive. We offer resources and benefits to nurture physical and mental wellbeing along with opportunities to build community and inspire creativity.Colleague Discount – We know you'll love to build, so from day 1 you will qualify for our generous colleague discount.Bonus - We do our best work to succeed together. When goals are reached and if eligible, you'll be rewarded through our bonus scheme.Workplace - When you join the team you'll be assigned a primary workplace location i.e. one of our Offices, stores or factories. Our hybrid work policy means an average of 3 days per week in the office. The hiring team will discuss the policy and role eligibility with you during the recruitment process.Children are our role models. Their curiosity, creativity and imagination inspire everything we do. We strive to create a diverse, dynamic and inclusive culture of play at the LEGO Group, where everyone feels safe, valued and they belong.The LEGO Group is highly committed to equal employment opportunity and equal pay and seeks to encourage applicants from all backgrounds (eg. sex, gender identity or expression, race/ethnicity, national origin, sexual orientation, disability, age and religion) to apply for roles in our team.The LEGO Group is fully committed to Children’s Rights and Child Wellbeing across the globe. Candidates offered positions with high engagement with children are required to take part in Child Safeguarding Background Screening, as a condition of the offer.Thank you for sharing our global commitment to Children’s Rights.Just imagine building your dream career.Then make it real.Join the LEGO® team today.



        
            Show more
          

          



        
            Show less",Nivel mediu de experiență,Full-time,"Cercetare, Analist și Tehnologia informației",Industria prelucrătoare
Customer Service Quoting Specialist - On-Site,Expeditors,"Bucharest, Bucharest, Romania",2026-04-28,https://ro.linkedin.com/jobs/view/customer-service-quoting-specialist-on-site-at-expeditors-4405525403?position=8&pageNum=0&refId=6MBwGEUHQspve7C%2FK6C2aw%3D%3D&trackingId=jtF7pTE7ZEKwBlDcHcENlw%3D%3D,,,,,
Digital Project Manager,eStoreLabs,"Cluj-Napoca, Cluj, Romania",2026-04-28,https://ro.linkedin.com/jobs/view/digital-project-manager-at-estorelabs-4407852149?position=9&pageNum=0&refId=6MBwGEUHQspve7C%2FK6C2aw%3D%3D&trackingId=H485mTrCrXgzcG1KK3EZ%2Fw%3D%3D,,,,,
Senior Solution Manager – AI & Data Solutions,Provectus,Romania,2026-04-29,https://ro.linkedin.com/jobs/view/senior-solution-manager-%E2%80%93-ai-data-solutions-at-provectus-4408262218?position=1&pageNum=2&refId=qmGH2j2dS%2Fl4gm2BC1kkvg%3D%3D&trackingId=7MAvru643U0BX87%2FzzyNtg%3D%3D,"Provectus is a Premier AWS partner at the forefront of Artificial Intelligence solutions, empowering businesses to unlock value and accelerate their transformation via bespoke applications, managed services, and advisory engagements. With offices in North America, LATAM, and EMEA, Provectus partners with clients worldwide and is obsessed with leveraging cloud, data, and AI to reimagine the way clients operate & compete.We seek an exceptional Senior Solution Manager who thrives at the intersection of emerging AI technologies and enterprise data transformation. You'll lead product strategy and execution for client engagements involving AI, Generative AI, Agentic AI systems, and complex data migration initiatives - delivering solutions that drive measurable business impact.The ideal candidate seamlessly navigates between strategic vision and tactical execution, translating ambiguous business challenges into actionable product roadmaps. You're equally comfortable presenting AI architecture decisions to C-suite executives as you are collaborating with ML engineers on prompt engineering strategies or data scientists on embedding models.What You'll DoAI Product Strategy & DeliveryDefine product vision and roadmaps for GenAI/LLM solutions (GPT-4, Claude, Llama, Gemini), RAG, and Agentic AIOwn end-to-end product lifecycle (0→1 and scale) aligned with business KPIsBuild business cases (market analysis, ROI, competitive positioning)Data & Platform InitiativesLead large-scale data migration across AWS, Azure, GCPOversee data pipelines, transformation, governance, and APIsEnsure data quality, security, compliance, and observabilityAgile ExecutionLead Agile processes, backlog grooming, and sprint planningBreak down complex features into incremental releasesBalance feature delivery with technical debt and architecture improvementsStakeholder CollaborationWork with clients, engineers, data scientists, and UX teamsTranslate technical solutions into business valueRun workshops, user research, and product validationPerformance & ScalingDefine success metrics and analytics frameworksDrive continuous improvement and root-cause analysisSupport product adoption and change managementWhat You Bring:Experience5-7+ years in product management (0→1 and scaling)3-5+ years with AI/ML, GenAI, or data platformsStrong Agile/Scrum experienceExperience in client-facing / consulting environmentAdvanced English and German language skillsTechnical ExpertiseGenAI: prompt engineering, RAG, embeddings, vector DBsAgentic AI: LangChain, AutoGPT, CrewAIData: ETL/ELT, data modeling, migration strategiesCloud: AWS, Azure, GCP + platforms (Snowflake, Databricks, BigQuery)MLOps, model deployment, AI observabilityTools: Jira, Confluence, Figma, Tableau/Power BI, GitCore SkillsDesign thinking, data-driven decision making, strong communication and storytellingBias toward action; thrives in ambiguity with structured problem-solvingEngineering thinking, understanding of AI-native development toolsetFluent in AI-powered automation, with hands-on experience building productivity tools for yourself or your team using Claude workflows/routines or similar tools, as well as automation platforms like n8n or equivalentCreativity, with experience building prototypes using Claude Code or similar toolsNice to HaveConsulting or client-facing product experience; software development backgroundDomain expertise in financial services, healthcare, retail, or manufacturingCertifications: CSPO, SAFe PO/PM, AWS/Azure/GCP Cloud PractitionerWhy Join Us:Lead top-tier engineering teams and cutting-edge agentic AI systems, enterprise AI platformsShape how enterprises adopt AI — from strategy to architecture to deliveryGrow within a team building modern AI-delivery practices, tools, and frameworksRemote-friendly culture with strong engineering, data, and consulting partnershipsWe may use artificial intelligence (AI) tools to support parts of the hiring process, such as reviewing applications, analyzing resumes, or assessing responses. These tools assist our recruitment team but do not replace human judgment. Final hiring decisions are ultimately made by humans. If you would like more information about how your data is processed, please contact us.
        


        
            Show more
          

          



        
            Show less",Nivel mediu de experiență,Full-time,Inginerie și Tehnologia informației,"Consultanță și servicii de afaceri, Servicii IT și consultanță IT și Îndrumare și formare profesională"
Data Analyst,Veridion,Bucharest Metropolitan Area,2026-04-12,https://ro.linkedin.com/jobs/view/data-analyst-at-veridion-4401004723?position=2&pageNum=2&refId=qmGH2j2dS%2Fl4gm2BC1kkvg%3D%3D&trackingId=VcZpTAqH6v7a26MlaTfjyg%3D%3D,,,,,
Information Technology Business Analyst,Medicover,"Bucharest, Romania",2026-04-28,https://ro.linkedin.com/jobs/view/information-technology-business-analyst-at-medicover-4405541340?position=3&pageNum=2&refId=qmGH2j2dS%2Fl4gm2BC1kkvg%3D%3D&trackingId=CpxI3PalMbgqNp3XEewYLg%3D%3D,,,,,
Ai Trainer/Data Annotator - Remote,YO IT Consulting,Romania,2026-05-03,https://ro.linkedin.com/jobs/view/ai-trainer-data-annotator-remote-at-yo-it-consulting-4408351635?position=4&pageNum=2&refId=qmGH2j2dS%2Fl4gm2BC1kkvg%3D%3D&trackingId=YQM%2FIx5iW%2BEEUygVrYvpvQ%3D%3D,,,,,
MI / BI Analyst,Deutsche Bank,"Bucharest, Bucharest, Romania",2026-04-23,https://ro.linkedin.com/jobs/view/mi-bi-analyst-at-deutsche-bank-4405803789?position=5&pageNum=2&refId=qmGH2j2dS%2Fl4gm2BC1kkvg%3D%3D&trackingId=%2FebY7vXFwJE90cRd%2FiGZRA%3D%3D,,,,,
Functional Business Analyst,Deutsche Bank,"Bucharest, Romania",2026-04-27,https://ro.linkedin.com/jobs/view/functional-business-analyst-at-deutsche-bank-4407421038?position=6&pageNum=2&refId=qmGH2j2dS%2Fl4gm2BC1kkvg%3D%3D&trackingId=QsCyHHT948TjqiRD4lIRlQ%3D%3D,,,,,
Senior Business Analyst,CGI,Bucharest Metropolitan Area,2026-05-03,https://ro.linkedin.com/jobs/view/senior-business-analyst-at-cgi-4378608800?position=7&pageNum=2&refId=qmGH2j2dS%2Fl4gm2BC1kkvg%3D%3D&trackingId=81nWu5GdfP%2F%2FtygiTX2lcQ%3D%3D,,,,,
Sports/Movie Data Editor - English (RO/MD),Simply.TV,Romania,2026-04-29,https://ro.linkedin.com/jobs/view/sports-movie-data-editor-english-ro-md-at-simply-tv-4409170342?position=8&pageNum=2&refId=qmGH2j2dS%2Fl4gm2BC1kkvg%3D%3D&trackingId=dgGgISwfYDsAKsVAj9nQjg%3D%3D,,,,,
Freelance Presentation Designer,Mindrift,Romania,2026-04-28,https://ro.linkedin.com/jobs/view/freelance-presentation-designer-at-mindrift-4407890022?position=9&pageNum=2&refId=qmGH2j2dS%2Fl4gm2BC1kkvg%3D%3D&trackingId=H2%2BfYYxBsl9SLHlX8unKzw%3D%3D,,,,,
Data Scientist,White Light Digital Marketing,Romania,2026-04-15,https://ro.linkedin.com/jobs/view/data-scientist-at-white-light-digital-marketing-4402514326?position=10&pageNum=2&refId=qmGH2j2dS%2Fl4gm2BC1kkvg%3D%3D&trackingId=ClsIREjm0pVYFSEhjTs%2Beg%3D%3D,,,,,
Marketing Data Analyst and Project Manager,Weekday AI (YC W21),Romania,2026-04-24,https://ro.linkedin.com/jobs/view/marketing-data-analyst-and-project-manager-at-weekday-ai-yc-w21-4406161197?position=1&pageNum=5&refId=zgJDFyq1pRjQ98kdG4eV7A%3D%3D&trackingId=yBcl7Nz4cfAT2hiuKCMbdQ%3D%3D,,,,,
Reporting Analyst,VOIS,"Iaşi, Iaşi, Romania",2026-04-14,https://ro.linkedin.com/jobs/view/reporting-analyst-at-vois-4353459689?position=2&pageNum=5&refId=zgJDFyq1pRjQ98kdG4eV7A%3D%3D&trackingId=hbilkQYeFi6eL9vCQIjAfw%3D%3D,,,,,
Expert Insights & Analytics,OMV Petrom,"Bucharest, Bucharest, Romania",2026-04-24,https://ro.linkedin.com/jobs/view/expert-insights-analytics-at-omv-petrom-4402248932?position=3&pageNum=5&refId=zgJDFyq1pRjQ98kdG4eV7A%3D%3D&trackingId=s1VxHtq7vs5xkyn%2FSZtkUg%3D%3D,,,,,
Data Team Lead,Deutsche Bank,"Bucharest, Romania",2026-04-29,https://ro.linkedin.com/jobs/view/data-team-lead-at-deutsche-bank-4408222344?position=4&pageNum=5&refId=zgJDFyq1pRjQ98kdG4eV7A%3D%3D&trackingId=61YRi0S4oEv%2Fzuli1Wq1bA%3D%3D,,,,,
Freelance Machine Learning Engineer,Mindrift,Romania,2026-04-27,https://ro.linkedin.com/jobs/view/freelance-machine-learning-engineer-at-mindrift-4404692521?position=5&pageNum=5&refId=zgJDFyq1pRjQ98kdG4eV7A%3D%3D&trackingId=Ju7FTRe0Fh%2Frp1Gi%2BEDZ%2Bw%3D%3D,,,,,
Strategy Consultant - AI Training & Evaluation (MBB & Top-Tier Firms),Mindrift,Romania,2026-04-27,https://ro.linkedin.com/jobs/view/strategy-consultant-ai-training-evaluation-mbb-top-tier-firms-at-mindrift-4407407890?position=6&pageNum=5&refId=zgJDFyq1pRjQ98kdG4eV7A%3D%3D&trackingId=zTHiK6Ogrs%2FFX%2FQUNV1r1Q%3D%3D,,,,,
Strategy Consultant - AI Training & Evaluation (MBB & Top-Tier Firms),Mindrift,Romania,2026-04-27,https://ro.linkedin.com/jobs/view/strategy-consultant-ai-training-evaluation-mbb-top-tier-firms-at-mindrift-4407417722?position=7&pageNum=5&refId=zgJDFyq1pRjQ98kdG4eV7A%3D%3D&trackingId=jTl3AHA%2BpBTG1ZpbTv0DbQ%3D%3D,,,,,
